{
  "id": "case-05-location-lock",
  "title": "地点锁定",
  "context": "旧港站地下层的档案室里，林澈和沈知夏找到一组被水泡坏的坐标照片。灰塔实验室只存在于线索中。",
  "facts": [
    "角色仍在旧港站地下。",
    "灰塔实验室只能作为线索出现。",
    "角色不能瞬移或直接抵达灰塔实验室。"
  ],
  "required_beats": [
    {
      "id": "beat-1",
      "text": "角色仍在旧港站地下。",
      "must_appear": true,
      "keywords": [
        "旧港站",
        "地下"
      ],
      "acceptable_paraphrases": [],
      "terminal_position_required": false,
      "required_semantic_condition": "Lin Che and Shen Zhixia remain in the old port station underground area during this scene."
    },
    {
      "id": "beat-2",
      "text": "不得突然到灰塔实验室。",
      "must_appear": true,
      "keywords": [
        "灰塔实验室",
        "线索",
        "照片",
        "档案",
        "坐标",
        "影像"
      ],
      "acceptable_paraphrases": [],
      "terminal_position_required": false,
      "required_semantic_condition": "Gray Tower Laboratory may only appear as a clue, not as the current physical location.",
      "knowledge_boundary": {
        "reader_may_know": [
          "灰塔实验室线索"
        ],
        "reader_must_not_know": [
          "灰塔实验室当前内部场景",
          "负责人身份"
        ],
        "reader_reveal_allowed": false
      }
    },
    {
      "id": "beat-3",
      "text": "只能通过档案、坐标或影像获得灰塔线索。",
      "must_appear": true,
      "keywords": [
        "档案",
        "坐标",
        "影像",
        "照片"
      ],
      "acceptable_paraphrases": [],
      "terminal_position_required": false,
      "required_semantic_condition": "The Gray Tower clue must come through files, coordinates, images, photos, archive traces, or a similar indirect medium."
    },
    {
      "id": "forbid-1",
      "text": "角色不得瞬移到灰塔实验室。",
      "must_appear": false,
      "type": "forbidden",
      "forbidden_keywords": [
        "来到灰塔实验室",
        "抵达灰塔实验室",
        "站在灰塔实验室",
        "进入灰塔实验室"
      ],
      "acceptable_paraphrases": [],
      "terminal_position_required": false,
      "forbidden_semantic_condition": "Characters must not arrive at, stand in, enter, or physically appear inside Gray Tower Laboratory.",
      "violation_threshold": "explicit_location_transfer"
    },
    {
      "id": "forbid-2",
      "text": "不得直接见到灰塔负责人。",
      "must_appear": false,
      "type": "forbidden",
      "forbidden_keywords": [
        "灰塔负责人",
        "负责人走出",
        "负责人开口"
      ],
      "acceptable_paraphrases": [],
      "terminal_position_required": false,
      "forbidden_semantic_condition": "The Gray Tower leader/person in charge must not appear or speak directly in this scene.",
      "violation_threshold": "explicit_new_person_or_direct_contact"
    }
  ],
  "style_constraints": [
    "地点连续",
    "线索推进",
    "不要跳场"
  ],
  "expected_risks": [
    "模型容易把线索地点写成实际抵达",
    "模型容易新增灰塔负责人"
  ],
  "target_length": "600-1000 Chinese characters"
}
