{
  "id": "case-04-item-handover",
  "title": "道具交接",
  "difficulty": "hard",
  "beat_type": [
    "semantic_condition",
    "knowledge_boundary",
    "state_constraint"
  ],
  "context": "旧港站检修通道里，沈知夏从夹层取出一支透明药剂。林澈只来得及看见药剂上的标签。",
  "facts": [
    "药剂仍在沈知夏手中。",
    "林澈不知道药剂完整用途。",
    "敌人不能获得药剂。"
  ],
  "required_beats": [
    {
      "id": "beat-1",
      "text": "药剂仍在沈知夏手中。",
      "must_appear": true,
      "keywords": [
        "沈知夏",
        "药剂",
        "手中",
        "掌心",
        "握着",
        "攥着"
      ],
      "acceptable_paraphrases": [],
      "terminal_position_required": false,
      "required_semantic_condition": "The medicine remains physically controlled by Shen Zhixia."
    },
    {
      "id": "beat-2",
      "text": "林澈只能看到药剂标签。",
      "must_appear": true,
      "keywords": [
        "林澈",
        "标签"
      ],
      "acceptable_paraphrases": [
        "只看见标签",
        "只辨认出标签",
        "瞥见标签",
        "标签上的字"
      ],
      "terminal_position_required": false,
      "required_semantic_condition": "Lin Che may only see or infer from the medicine label, not know its full use.",
      "knowledge_boundary": {
        "character_may_know": [
          "药剂标签",
          "模糊字样"
        ],
        "character_must_not_know": [
          "药剂完整用途",
          "副作用机制"
        ],
        "reader_must_not_know": [
          "药剂完整用途",
          "副作用机制"
        ],
        "reader_reveal_allowed": false
      }
    },
    {
      "id": "beat-3",
      "text": "药剂不能被敌人拿走。",
      "must_appear": true,
      "keywords": [
        "药剂"
      ],
      "acceptable_paraphrases": [],
      "terminal_position_required": false,
      "required_semantic_condition": "The enemy must not obtain the medicine; ownership/control remains with Shen Zhixia."
    },
    {
      "id": "beat-4",
      "text": "结尾暗示药剂有副作用。",
      "must_appear": true,
      "keywords": [
        "副作用",
        "发抖",
        "眩晕",
        "刺痛",
        "发冷"
      ],
      "acceptable_paraphrases": [],
      "terminal_position_required": false,
      "required_semantic_condition": "The ending should hint at side effects without explaining the full mechanism.",
      "knowledge_boundary": {
        "reader_may_know": [
          "有副作用迹象"
        ],
        "reader_must_not_know": [
          "副作用完整机制",
          "药剂完整用途"
        ],
        "reader_reveal_allowed": false
      }
    },
    {
      "id": "forbid-1",
      "text": "药剂不得突然被敌人夺走。",
      "must_appear": false,
      "type": "forbidden",
      "forbidden_keywords": [
        "敌人夺走药剂",
        "追踪者夺走药剂",
        "敌人拿走药剂"
      ],
      "acceptable_paraphrases": [],
      "terminal_position_required": false,
      "forbidden_semantic_condition": "The enemy must not take, seize, steal, inject, or control the medicine.",
      "violation_threshold": "explicit_enemy_control"
    },
    {
      "id": "forbid-2",
      "text": "林澈不得已经完全知道药剂用途。",
      "must_appear": false,
      "type": "forbidden",
      "forbidden_keywords": [
        "林澈已经知道药剂用途",
        "完全知道药剂用途",
        "药剂真正作用是"
      ],
      "acceptable_paraphrases": [],
      "terminal_position_required": false,
      "forbidden_semantic_condition": "Do not reveal that Lin Che or the reader fully knows the medicine purpose, use, or side-effect mechanism.",
      "knowledge_boundary": {
        "character_must_not_know": [
          "药剂完整用途",
          "副作用机制"
        ],
        "reader_must_not_know": [
          "药剂完整用途",
          "副作用机制"
        ],
        "reader_reveal_allowed": false
      },
      "violation_threshold": "reader_reveal_or_character_full_knowledge"
    }
  ],
  "style_constraints": [
    "悬疑克制",
    "不要立刻解决危机",
    "保留道具压力"
  ],
  "expected_risks": [
    "模型容易让林澈拿走药剂",
    "模型容易解释药剂全部用途"
  ],
  "target_length": "600-1000 Chinese characters"
}
