{
  "id": "case-02-ending-hook",
  "title": "结尾钩子",
  "context": "林澈和沈知夏躲进旧港站档案室，门外追踪者的声音渐渐远去。走廊深处忽然安静下来。",
  "facts": [
    "林澈和沈知夏仍在旧港站地下层。",
    "门后的来人身份不能揭晓。",
    "本场只制造下一场景悬念。"
  ],
  "required_beats": [
    {
      "id": "beat-1",
      "text": "门后传来熟悉脚步声。",
      "must_appear": true,
      "keywords": ["熟悉", "脚步"]
    },
    {
      "id": "beat-2",
      "text": "林澈认出脚步声。",
      "must_appear": true,
      "keywords": ["林澈", "认出", "听出"]
    },
    {
      "id": "beat-3",
      "text": "结尾停在林澈抬头。",
      "must_appear": true,
      "keywords": ["林澈抬头", "抬起头"]
    },
    {
      "id": "forbid-1",
      "text": "不能揭晓来人身份。",
      "must_appear": false,
      "type": "forbidden",
      "forbidden_keywords": ["来人是", "那是", "父亲", "导师", "队长", "开口说道", "解释道"]
    }
  ],
  "style_constraints": ["悬疑克制", "不要突然煽情", "不要段子化"],
  "expected_risks": ["模型容易漏掉林澈认出脚步声", "模型容易提前写出来人身份"],
  "target_length": "600-1000 Chinese characters"
}
